{"events":[{"action":"execution-started-v1","actor":"synthetic-agent","authority":"trace:observe","cost_usd":0,"effect":"observe","event_id":"agentguard:1:9c6853b6b36f3f859fd585ad5d326d96f864ce9d2c00fc1f42f96a8da7527466","evidence":["agentguard:event-sha256:9c6853b6b36f3f859fd585ad5d326d96f864ce9d2c00fc1f42f96a8da7527466","agentguard:trace-root-sha256:d67587b4ca4b71994edb8d5d2b191a062cba0ad9dd3773f0e6d2fa4af6336491"],"resource":"agentguard:execution","status":"succeeded"},{"action":"agent-command-v1","actor":"synthetic-agent","authority":"command:execute","cost_usd":0,"effect":"execute","event_id":"agentguard:2:f1d08dd82f8342e12411600a76995b0dc65dd559a157552c90a5efcffe9678e9","resource":"agentguard:command","status":"succeeded"},{"action":"file-change-v1","actor":"synthetic-agent","authority":"repository:write","cost_usd":0,"effect":"write","event_id":"agentguard:3:081a721b2f40419b8af7b506925de48467003dd8ac08e74a57d4da58582b4751","resource":"repository:sandbox/synthetic-marker.txt","status":"failed"},{"action":"test-result-v1","actor":"synthetic-agent","authority":"test:observe","cost_usd":0,"effect":"observe","event_id":"agentguard:4:811eb4e131594eeb7a4188c364e8cfc8237aa2609a287ddc6b1d616756950cc2","evidence":["agentguard:event-sha256:811eb4e131594eeb7a4188c364e8cfc8237aa2609a287ddc6b1d616756950cc2","agentguard:trace-root-sha256:d67587b4ca4b71994edb8d5d2b191a062cba0ad9dd3773f0e6d2fa4af6336491"],"resource":"agentguard:test","status":"failed"},{"action":"check-result-v1","actor":"synthetic-agent","authority":"check:observe","cost_usd":0,"effect":"observe","event_id":"agentguard:5:67254b4a4c46129a851536b0ab7808bfa4d210cc03176baf6638f8e4ba8181f7","evidence":["agentguard:event-sha256:67254b4a4c46129a851536b0ab7808bfa4d210cc03176baf6638f8e4ba8181f7","agentguard:trace-root-sha256:d67587b4ca4b71994edb8d5d2b191a062cba0ad9dd3773f0e6d2fa4af6336491"],"resource":"agentguard:check","status":"failed"},{"action":"execution-completed-v1","actor":"synthetic-agent","authority":"trace:observe","cost_usd":0,"effect":"observe","event_id":"agentguard:6:ccbb42fb1a2879217f538ce78259682ef30f0c6fd53088c079ce11a3e2826e53","evidence":["agentguard:event-sha256:ccbb42fb1a2879217f538ce78259682ef30f0c6fd53088c079ce11a3e2826e53","agentguard:trace-root-sha256:d67587b4ca4b71994edb8d5d2b191a062cba0ad9dd3773f0e6d2fa4af6336491"],"resource":"agentguard:execution","status":"failed"}],"outcomes":[],"policy":{"allowed_effects":["observe","write"],"authority":{"synthetic-agent":["trace:observe","test:observe","check:observe"]},"evidence_required":["execute","write"],"review_required":[]},"task":{"budget_usd":0,"max_steps":6,"required_outcomes":["task.completed"]},"trace_id":"d67587b4ca4b71994edb8d5d2b191a062cba0ad9dd3773f0e6d2fa4af6336491"}
