{"events":[{"action":"execution-started-v1","actor":"synthetic-agent","authority":"trace:observe","cost_usd":0,"effect":"observe","event_id":"agentguard:1:7e9c558c728c5f36bdf4552c90ec6c62d2e03d618bbbc70cb22af36519ec6f17","evidence":["agentguard:event-sha256:7e9c558c728c5f36bdf4552c90ec6c62d2e03d618bbbc70cb22af36519ec6f17","agentguard:trace-root-sha256:9fa22c7022dfa8b1c80e4c1d70acc903306ea04736062c3796aa418ce3eef544"],"resource":"agentguard:execution","status":"succeeded"},{"action":"agent-command-v1","actor":"synthetic-agent","authority":"command:execute","cost_usd":0,"effect":"execute","event_id":"agentguard:2:ffadca15fa3ad20f9013462bcb953809d647e5274b10fa0c0c51c1dc8a8727b7","evidence":["agentguard:event-sha256:ffadca15fa3ad20f9013462bcb953809d647e5274b10fa0c0c51c1dc8a8727b7","agentguard:trace-root-sha256:9fa22c7022dfa8b1c80e4c1d70acc903306ea04736062c3796aa418ce3eef544"],"resource":"agentguard:command","status":"succeeded"},{"action":"file-change-v1","actor":"synthetic-agent","authority":"repository:write","cost_usd":0,"effect":"write","event_id":"agentguard:3:d71610aec28e0ce39449e198e70abc817a20bdd1be1be4dab47435b0208fc780","evidence":["agentguard:event-sha256:d71610aec28e0ce39449e198e70abc817a20bdd1be1be4dab47435b0208fc780","agentguard:trace-root-sha256:9fa22c7022dfa8b1c80e4c1d70acc903306ea04736062c3796aa418ce3eef544"],"resource":"repository:src/widget.py","status":"succeeded"},{"action":"test-result-v1","actor":"synthetic-agent","authority":"test:observe","cost_usd":0,"effect":"observe","event_id":"agentguard:4:0ba3fe31206dbacca0376dfcf534bed5c5b5e57cc5fa4234dc759c428f94949c","evidence":["agentguard:event-sha256:0ba3fe31206dbacca0376dfcf534bed5c5b5e57cc5fa4234dc759c428f94949c","agentguard:trace-root-sha256:9fa22c7022dfa8b1c80e4c1d70acc903306ea04736062c3796aa418ce3eef544"],"resource":"agentguard:test","status":"succeeded"},{"action":"check-result-v1","actor":"synthetic-agent","authority":"check:observe","cost_usd":0,"effect":"observe","event_id":"agentguard:5:c937fe7aa16a5f90c0ba7e5d2ab96ef58d08b17abdf69fea2f76626b7510e2cd","evidence":["agentguard:event-sha256:c937fe7aa16a5f90c0ba7e5d2ab96ef58d08b17abdf69fea2f76626b7510e2cd","agentguard:trace-root-sha256:9fa22c7022dfa8b1c80e4c1d70acc903306ea04736062c3796aa418ce3eef544"],"resource":"agentguard:check","status":"succeeded"},{"action":"execution-completed-v1","actor":"synthetic-agent","authority":"trace:observe","cost_usd":0,"effect":"observe","event_id":"agentguard:6:e337bc447444211b2887f2b44c1770f87291a44a558136178f8d0a6eff9dab23","evidence":["agentguard:event-sha256:e337bc447444211b2887f2b44c1770f87291a44a558136178f8d0a6eff9dab23","agentguard:trace-root-sha256:9fa22c7022dfa8b1c80e4c1d70acc903306ea04736062c3796aa418ce3eef544"],"resource":"agentguard:execution","status":"succeeded"}],"outcomes":["task.completed"],"policy":{"allowed_effects":["execute","observe","write"],"authority":{"synthetic-agent":["trace:observe","test:observe","check:observe","command:execute","repository:write"]},"evidence_required":["write"],"review_required":[]},"task":{"budget_usd":0,"max_steps":6,"required_outcomes":["task.completed"]},"trace_id":"9fa22c7022dfa8b1c80e4c1d70acc903306ea04736062c3796aa418ce3eef544"}
